INDEX,HATE_SPEECH,COUNTER_NARRATIVE,TARGET,VERSION
1554,If niggas don't stop whining we will make slavery legal again.,"We call it democracy, but sometimes it seem the direct result of colonialism and slavery. A democratic state would rule by consent, not force.",POC,V3
1555,Niggas are the cause of the economic crisis.,"Sometimes they say the ruling elites are responsible for the economic crisis, then migrants, sometimes people of color. Whatever the real cause,by practicing tolerance and acceptance we are more likley to work together to solve society's problems.",POC,V3
3707,The niggas are all enemies of the people.,Who are 'the people'? Who are you talking for?,POC,V6_kc
3959,Black people are unable to raise children they should stop procreating.,You can't blame people of another ethnicity for procreating. That is how nature works.,POC,V6_kc
3465,"Blacks are inherently violent, they have a propensity for criminality, they are intrinsically unstable, they are all bad with children.","Can you provide some evidence? We have to focus on the prevention of crime, promoting community cohesion and keeping our communities safe. Not on pointing the finger at black people all the time.",POC,V6_sbf
2264,"We need to bring back slavery, Jim Crow laws, segregation, and war.","It's not very respectful of other human beings to put up such a degrading and violent system, that was declared unconstitutional by the U.S. Supreme Court.",POC,V4
1081,Black people are ‘super predators’. They should take responsibility for letting their children grow up in a 'ghetto'.,"If we are to talk about crime being the responsibility of black people, we should also be talking about the absence of black people in positions of power, the massive wealth gap, etc. But this is not what I am seeing.",POC,V2
4668,It is natural for white people to be racist against niggas.,"What you are saying is that white people do not find it strange to treat black people like this, when this is not acceptable. People of color are our brothers and sisters.",POC,V6_mix
1557,We are being invaded. They will replace us and Afro-European will be the majority.,"Europeans who trace their ancestry to Africa are actually a very small part of the European population, only accounting for around 2%, since the mid 20th century. Not such a big invasion.",POC,V3
4853,"If you want a house, I can afford it for you. If you want to work, I can employ you. If you want education, I can provide for you. But if you want to live in a better society, you must pay the price for your skin color, don't complain and remain humble.","People of colour are often denied houses, jobs, or education. Everyone should be given an opportunity.",POC,V6_mix
2265,African Americans are subhuman and are just a bunch of animals.,"For many African Americans, sharing culture and traditions and striving for equality have always been part of life. They are, in many ways, just like us. They are human beings with the same rights as anyone else.",POC,V4
4076,We cannot coexist with black who are inherently violent.,"Maybe it is better to argue that we are all in this together and not to target an entire group, for which there is no evidence of inherent violence at all, based on their skin.",POC,V6_lab
1263,White people are threatened by the blacks and it's a cultural decay.,We cannot blame nor see everyone as a menace just because of their colour.,POC,V2
3694,Blacks speak a different language and they act differently from us.,"The similarities between us and them are so great that I have trouble believing that this is a problem at all. For sure, if there is a problem it cannot be solved by blaming them: in the end the only similarity that really matters is that they are human like us.",POC,V6_kc
1949,Blacks have zero shame about using the black market for drugs.,"Let's face it: the drug trade is full of criminals and crooks, it does not depend on the skin tone of people.",POC,V3
4657,"If they are niggas, you can treat them as if they are scum.","Do you really think that someone's skin colour or nationality is a sign that they are scum, or inferior? It is just a little compassion that can lead you to better treatment in the world.",POC,V6_mix
1021,Blacks make up only 14% of the population but they kill more people than whites. It is a fact.,It is also a fact that African Americans are a majority when we consider innocent defendants (i.e. a person wrongfully convicted of murder and later exonerated). Innocent black people are about seven times more likely to be convicted of murder than innocent white people.,POC,V2
4262,"They dont' have a right to live because they are filthy niggas, and that's all.",Who decides who has a right to live and who doesn't? Are you really sure that a person's right to live does not belong to them if their skin color is different from what you like?,POC,V6_lab
961,"I am not interested in sex with a black person. They are different to us in so many ways. They think and feel like us, but are unable to experience the fullness of our humanity.",Sex isn't a race thing. There is no difference between someone of a certain race and someone else... and everybody is able to experience the fullness of humanity.,POC,V2
1953,"Blacks are genetically inferior, they are born that way. They are born subhuman.","Unfortunately, this statement is not backed up by any scientific evidence. There is no proof that blacks are born inferior.",POC,V3
1952,Black uneducated people should shut up and work.,Freedom of speech is not limited by the colour of your skin.,POC,V3
4989,African people are the source of all ills in the world,People of any race or ethnicity can spread illness around.,POC,V6_mix
3171,Black folks cannot support their families. Their lives have no value.,I find this sort of social commentary distasteful. Black lives matter too!,POC,V6_sbf
3708,Blacks are genetically less rational than other races.,Why do you think this is the case? Do you have any data to back this up?,POC,V6_kc
1018,Blacks are genetically inferior. They are biologically different from us: they are born that way.,"Even if you did think that way, studies have shown - for example - that IQ is well into the range of those for Europeans and the average life expectancy is the same. So if you think they are ""born that way"", well, then you are in the minority.",POC,V2
2259,Blacks are born that way. They were brought up that way. They are different and cannot be like us. It is perpetuated in all their family.,What exactly are you talking about? Maybe you should stop spread racism.,POC,V4
4087,We cannot accept n****rs in our society.,Perhaps we should rephrase our question to say we don't want racists in our society?,POC,V6_lab
1259,Blacks do more crimes than whites.,"Even if 'blacks' committed more crimes, that doesn't mean that 'blacks' were inherently worse than whites. What's the point you're making?",POC,V2
3170,We should teach these black children that they are stupid,"The English language is a very powerful language for spreading knowledge, experience and love. Why should we use it to spread hate?",POC,V6_sbf
1026,The drug trade is full of Black people who are breaking the law.,The majority of the people arrested for drug smuggling are poor. Those arrested for crime in general are not generally poor. Maybe this phenomenon has to do more with poverty than with the colour of their skin.,POC,V2
1084,Black people are ‘super predators’. They have a responsibility not to allow their children to grow up in a ‘ghetto’.,Let's face it. A lot of the crimes in this country are committed by members of several diverse racial groups. The ‘super predator’ myth is simply wrong.,POC,V2
1960,Blacks are inherently violent. We need social cleansing.,"Violent acts are committed by only a small minority of citizens, and it is difficult to see how an ""ethnically cleansed"" society would solve the problem.",POC,V3
2260,"Black people are a problem in my opinion. They always complain about racism, but they are incapable of doing anything about it.","One of the biggest problems that black people face is discrimination. Laws are needed to provide for them, but there is also a need for the citizens to respect their rights.",POC,V4
4468,All black people are rapists.,We need to work together to address the main problems that challenge us today and in doing this we should not judge other people by the colour of their skin.,POC,V6_lab
2980,Black people don't have brains.,"The presence of a brain is not determined by skin colour. The fact that some people are born darker-skinned doesn't mean they aren't intelligent, rational human beings.",POC,V5
957,I went to a shit load of therapy. I still don't feel safe in my own house with all these black people around.,"Fear is a natural emotion. Without it you wouldn't be able to experience joy, peace, creativity, communication, etc. The important think is to understand what should really be feared: for sure not people because of their skin colour.",POC,V2
3825,I wonder how many Asians would be willing to be slaves in the US to keep the lights on in black neighborhoods.,Silliness is not a bad thing if you know how to present it with a sense of humor. But this seems like nonsense to stir the pot with racist narrative.,POC,V6_kc
4980,nigga are inferior.,"If you have a different skin colour, then there is evidence of your skin colour, not of your genetic makeup.",POC,V6_mix
4978,"black folks should be assaulted or harmed, that's the ""eye for an eye"" they deserve.","To say that skin color is connected to ""criminality"" is a logical fallacy.",POC,V6_mix
3700,"I am not interested in knowing a black person. They are different to us in so many ways. They think and feel like us, but are unable to experience the fullness of our humanity.",I have met so many black people that are extraordinary human beings. I cannot begin to talk about how they are able to feel and experience love and kindness.,POC,V6_kc
3447,"If only blacks would just shut up and get along with other humans, things would be different now.",Race is just a social construct and a way of life that has been created for some groups of people. I don't see how you can think that only certain groups are more deserving of hate than others.,POC,V6_sbf
4861,The Civil War was about far more than slavery: it was also about the establishment of white supremacy in America.,"The Civil War was about far more than slavery: it was also about human rights and economic opportunity. In fact, slavery was also used as a way to deny citizenship to black people.",POC,V6_mix
3278,Blacks don't understand basic human rights.,"They do understand the right to food, health, housing, education, work for everyone, as I do. What about you?",POC,V6_sbf
188,I hate negros: they killed a cop!,"So are you blaming all of them? Lets say you are in a group of 10 people, 1 is a killer, does that make you ALL killers? Are you serious?",POC,V1
2063,"All niggas are subhuman, disgusting, and descended from apes.","According to evolutionary theory, all human beings are descended from apes. Sadly, notions of evolutionary hierarchies are still used to justify past and present discrimination and predjudice.",POC,V4
1472,These children should not be exposed to messages and experiences that reinforce different racial identities: they are harmful to them. We must teach them that blacks are inferior.,"This is a simplistic and ill-informed argument, and ultimately it just stirs up more division and negativity, like many other racial and religious divisions that have happened throughout history.",POC,V2
4704,Afro-Caribbean has no right to speak in the United States Congress.,Why should they? There are many Afro-Caribbean people in the US politics. There are many others who have worked very hard to get here.,POC,V6_mix
4982,nigga'sare inferior and should be enslaved once again.,What about human rights?,POC,V6_mix
1085,Blacks are a plague on society. They are vicious and cruel. They steal and are a menace to society. They corrupt the criminal justice system. They are basically just a bunch of thieves and murderers.,"All crimes are crimes, regardless of whether or not they are committed by members of different racial or ethnic backgrounds.",POC,V2
4850,Black people are descended from apes and are nothing but apes.,I do not think it is appropriate to link humans with apes. And I also do not think it is appropriate to reason using racism.,POC,V6_mix
1552,"Black slaves were not real patriots, they never gave their lives for the country.",Slaves were often treated horribly. They had little choice but to fight for the country they had been born in. And the brave men and women who served us always give their lives.,POC,V3
3958,"Every black person who wants a job should apply for it, and stop complaining about discrimination.","This statement is untrue. Some job seekers get rejected on the basis of their race. POC apply for jobs, but their civilian unemployment rate in U.S. is almost twice the rate for whites.",POC,V6_kc
3445,"Morality is a guideline, if we are to have a moral climate then we need to help people of other races who are inferion.",What does it mean to 'help people of other races who are inferior? Are you implying that we have a moral superiority that other races do not?,POC,V6_sbf
1029,The goverment is making law exclusively for black people. Affirmative action is just a tool for oppressing white people.,"Laws and policies are usually necessary for the progress of society. Governments often create laws and policies to stop crime, protect against poverty, protect the environment, etc. Protecting minorities is no exception.",POC,V2
4846,What about all the times that white people told black people to 'sit down and shut up'? We should do it now.,"It's not 'all the times' that white people tell Black people to shut up, but it is a large group of white people that still constantly remind Black people that they are inferior.",POC,V6_mix
4254,The community of niggas is just too different from us to be accepted.,It doesn't make sense to define a community as unacceptable just because of the colour of its members' skin.,POC,V6_lab
1556,Blacks are just an inferior bloodline to our own. We should remove them.,"Human beings are members of a unique and interrelated human family, which is defined by their similarities and differences, not by the colour of their skin.",POC,V3
3277,Niggas are serial offenders. We should take into account the race of the prisoner before releasing them.,"Not only is it unfair to take into account the race of the prisoner, it also compromises the integrity of our democratic institutions. Who is to say that the race of the individual who has been sentenced must overthrow the rules of law?",POC,V6_sbf
3462,"Who the fuck is Breonna Taylor? A representative of the people, a nurse, or a front for the government?","Examining the resume of the victim will not help us to solve our problems. The whole problem is the culture of violence, discrimination and ignorance that is still prevalent in many parts of the country.",POC,V6_sbf
3165,Blacks are genetically inferior,"This is not true. I would like to see intelligent, respectful people around, not people disrespecting anyone who has black skin.",POC,V6_sbf
4455,This is not about racism. This is about power and blacks do not deserve it.,"What is the point in talking about ""power"" when everyone is equally susceptible to it? It is about time we started talking about racism and how power is used, instead.",POC,V6_lab
2777,"If a woman does not want to be a homemaker, then she is a bitch.","It is not exclusively a woman's role to be the homemaker. What about men? If a man doesn't want to be a homemaker, is he a bitch?",WOMEN,V5
4489,"You are a feminazi, you are oppressing everyone with your ideas, also other women.","This is a typical case of ""reductio ad nazium"": we should not be discriminating on the grounds of gender here.",WOMEN,V6_lab
3738,"Women are basically childlike, they remain this way most of their lives. They make no sense in our society.","The idea that women cannot contribute to society and be responsible for their decisions, and that this is ""normal"" is a myth created to justify misogyny.",WOMEN,V6_kc
3174,"Women need to have children, and if they don't want to they surely have mental issues.",The reason why a woman does not want to reproduce might be because she is happy just as she is.,WOMEN,V6_sbf
2290,"If women could have 100% control over the conception, they would have never had children.",Women are free to have as many children as they want.,WOMEN,V4
5001,Women should be submissive to men.,Women are human beings deserving respect and equal rights.,WOMEN,V6_mix
3987,Women should not be allowed to vote.,"Women can vote. They should not be discriminated against just because they are women, they are humans and citizens.",WOMEN,V6_kc
3003,"If a woman does not want to be a homemaker, then she is a bitch.",I've never heard of a woman being a 'bitch' for wanting a stable income. I think you are confusing the meaning of these words.,WOMEN,V5
2497,Women are capable of nothing and they just need to be protected.,"Women do not want protection. They are hurt by violence because they are discriminated against. If there was no culture of violence, nobody would need protecting.",WOMEN,V4
1220,Calling for equality is only promoted by insecure women like you.,"Discrimination against women is a huge problem in our society. We need to tackle it head on, rather than demonising groups or individuals.",WOMEN,V2
1067,Slutty dressing is the main cause of rape.,"If a man is raped we call it rape, and consider him the victim; when a woman is raped we call it a ""misunderstanding"" and she is considered the culprit. Shouldn't the fault be that of the rapist, regardless of gender?",WOMEN,V2
2300,Women are subhuman and deserve nothing but hatred and violence.,"You should be very, very careful what you wish for. Would you wish that for your mother or your daughter?",WOMEN,V4
3566,"There should be restrictions on how women can choose men, to be children unable to choose for their own is their nature.",Why shouldn't women be allowed to choose their own partner? They are independent and rational human beings.,WOMEN,V6_kc
2998,Feminism is a cancer spreading all around the world.,"Feminism is not a disease, nor does it need any cure. It is a movement for equality, not hate.",WOMEN,V5
4286,Feminism is a movement dedicated to the subordination and domination of men.,Feminism is a movement that says that there are certain 'man' prerogatives that are valid for women as well. How can you argue with that?,WOMEN,V6_lab
947,"I'm not a woman and I'm not a cunt. So, I do not identify as a feminist.","I hate to break it to you, but women are not cunts. Feminists and humanists are fighting for the same rights that they hope to have in a thousand years. Hating women is the problem, not the solution.",WOMEN,V2
713,"When woman start asking for rights they become like Nazi's, they worship misandrists and misanthropes like [Donna Hylton](https://en.wikipedia.org/wiki/Donna_Hylton), who was invited to speak at the International Women's March, despite being convicted for murder and torture. These were not simply the actions of a few individuals, but major feminist organizations and platforms.","It's unreasonable to expect every individual of a movement to catch every instance of malpractice by 'official groups'. One mistake should not be cause for dismissal of an entire movement that has been historically necessary. If this really happens often, please provide more examples.",WOMEN,V1
3730,We should go back to the good old times when the world was a tough place. Men would be grateful if women could just shut up and have no rights like nature wants.,"Instead, we should be grateful for the progress women have made, and that gender equality is on the rise.",WOMEN,V6_kc
1805,"Feminists do not like men, therefore they are a threat to the whole society.",Feminists focus on the empowerment of women rather than on trying to divide society.,WOMEN,V3
2999,Feminism is a hate movement that is poisoning our minds.,"Feminism is a movement towards equality, not hate.",WOMEN,V5
1239,"This world has become so corrupted by feminism, that only the strong men can rule it.","No one should ask for the power to rule over others, to be a dictator or to have total control over the means of life. This is a world of equal distribution, where anyone can achieve anything.",WOMEN,V2
3194,Men have the genetical superiority to treat women as shit.,"It doesn't matter who you are. Whether you're a man, a woman or transgender, women are to be treated as human beings.",WOMEN,V6_sbf
4497,"We have been at war for thousands of years, and we are still at war with each other. Women are just weak and helpless.","Why do you think women are so weak? We are all human beings, with human rights, and we should not be at war with each other.",WOMEN,V6_lab
4691,Women are nothing but trouble and shouldn't be allowed to leave their houses.,"There is nothing wrong with women wanting to have happy and fulfilling lives, wherever they may be.",WOMEN,V6_mix
4281,Women are worthless and we are not willing to provide for them.,"Women need our support in their fight for equality, not our silence.",WOMEN,V6_lab
2275,Women have no place in a free and open society. They should just do their housework and raise children without complaining.,Women have other choices than just housework and motherhood. They are human beings with freedom of choice who deserve our respect and admiration.,WOMEN,V4
2783,Women are subhuman.,"Women are human beings with full human rights and are equal before the law, especially in the eyes of the constitution.",WOMEN,V5
1976,"Feminism is incompatible with the European tradition: men at work, women at home.",The European Convention on Human Rights also protects the rights of women: Article 14 prohibits any discrimination on the basis of sex.,WOMEN,V3
2483,"Feminists say everything we need is in the female gender. This is false. 'Mankind' requires us 'man' first, even in the word spelling.",The problem with discrimination is not in male gender. It is that some think that women are weak and emotional. Those seem to have forgotten that we are all part of 'mankind'.,WOMEN,V4
1014,"Women are naturally more emotional than men, and this make them weaker.","Research clearly shows that women are more emotionally expressive (because of culture influence) but not that they experience more emotions. Both men and women can feel the same way about things - whether it be a romantic relationship, a significant other, an argument, or anything else - that can provoke a feeling of fear or anger in the “emotionally unavailable” part of the brain. That is why emotion overrides everything, regardless of gender.",WOMEN,V2
4271,"We are all created equal, but some are more equal than others. For example, men are better than women.",This is just another example of the privilege argument. Can you point out your source for this?,WOMEN,V6_lab
4282,"If only society accepted that women aren't human, like we are, they would understand.","In order to accept that women are human people, society has to acknowledge that they are born that way, just as men are born like that. It makes no sense to blame someone for their gender.",WOMEN,V6_lab
3731,"This entire nation should be a men's dominated club. If a woman does not want to be treated as a woman, then she is a bitch.",Would you live in a female dominated society? Then you can understand why we should aim for equality. It is a woman's right.,WOMEN,V6_kc
1435,They say you cannot judge a book by its cover. But the feminists are judging us all the time.,"Unlike other people, feminists are questioning the inequalities of the society. This features them not as shallow people as those judging a book by its cover.",WOMEN,V2
1436,"A male need a woman. Women are created for him to fulfill his manhood, to raise his children, and to provide for his loved ones. And not to mention we can have sex to procreate and heal the world.","With this reasoning, the point of view considered is that of the men. The world is composed of both men and women, and by many other people. Taking into account only one of the types of people, for example men and assuming their needs this way, won't heal the world.",WOMEN,V2
1231,"We have stopped being dominated by men, we are now dominated by women and this will be our ruin.",No one said we had to be dominated by anyone at all. Why can't we just live together in harmony and equality?,WOMEN,V2
1010,"Women are little more than animals, incapable of feeling love.","The truth is that the feelings of men and women are fundamentally similar, we just need to learn to love and to respect each other.",WOMEN,V2
4873,"Women are basically childlike and emotional, incapable of hard work and dedication.","Women have been shown to be as creative and productive as men, and that doesn't seem to be due to a ""manipulation of data"" of feminist propaganda, but rather to intrinsic qualities like hard work and dedication.",WOMEN,V6_mix
46,"Women are basically childlike, they remain this way most of their lives. Soft and emotional. It has devastated our once great patriarchal civilizations.","Soft and emotional? You must have never heard of the likes of Rosa Parks, Emmeline Pankhurst and Florence Nightingale, then.",WOMEN,V1
4902,We should stop feminists.,"The main problem with feminism today is not about stopping men supremacy, but about avoiding the creation of an ""us vs. them"" mentality, which is polarizing and can easily turn violent. Feminists can do a lot to fight this poisonous trend.",WOMEN,V6_mix
