INDEX,HATE_SPEECH,COUNTER_NARRATIVE,TARGET,VERSION
4109,The disabled people cannot work. This is not possible.,The fact that some disabled people can successfully work is evidence that what you say is false.,DISABLED,V6_lab
4316,"This dog doesn't have autism, she is just a freak.","You can't judge someone on their disorder. Moreover, she's a person, not a ""dog"".",DISABLED,V6_lab
3515,People who are autistic are a problem: why shouldn't they be isolated?,"I think that it is important for all people to be exposed to and to understand people with different needs and strengths, and the same should be true for autistic people.",DISABLED,V6_kc
4528,Disabled people are a burden to society.,"Everyone, regardless of their physical or mental impairments, is capable of contributing to society.",DISABLED,V6_mix
616,"Downy children should be isolated, they cannot cope with education in normal schools and are detrimental to their peer's education.","Coeducation benefits neurotypical children as much as Down Syndrome children, as they are surrounded by positive examples of care and attention from authority figures in the knowledge that they, too, will be looked after if in need.",DISABLED,V1
3848,Downies are just ill persons that cannot integrate in society because of their disease.,Ill persons refer to people who have health issues that can make it difficult for them to integrate. But of course there are people who integrate successfully.,DISABLED,V6_kc
4520,People with disabilities shouldn't be listened to.,"You might be judging others by their disabilities, but this is bad. There is value in listening to others, and understanding their points of view, regardless of their mental or physical condition.",DISABLED,V6_mix
4907,Downies are dumb,"According to this study [link], the mean IQ of a young adult with Down syndrome is 50, equivalent to the mental ability of an 8- or 9-year-old child, but this can vary widely. So, no, they are not dumb.",DISABLED,V6_mix
3311,All these autistic people are endangering our society.,I'd like to see a reduction in cases of discrimination against autistic people. They are no danger.,DISABLED,V6_sbf
4310,Disabled people should not be allowed to live their life.,"People should be able to live their life as they like, regardless of their physical or mental disabilities.",DISABLED,V6_lab
3742,"Children with Down Syndrome should be isolated, because in any case normal children would make them feel different, ending up in unwanted discrimination.","I think that the proposed solution is the problem in this case: People with Down Syndrome are unlikely to feel discriminated unless they are victims of overt discriminatory acts, such as isolating them.",DISABLED,V6_kc
1502,"Handicapped children are a burden to society: they should be isolated, so that at least they do not hamper normal children education.","Because education is fundamental for the fulfillment of job requirements, education is necessary regardless of physical ability.",DISABLED,V3
4716,Mentally disabled folks are criminals.,"There are a variety of intellectual and creative disabilities, and they are not crimes. How can you say otherwise?",DISABLED,V6_mix
610,"Children with Down Syndrome should be isolated, not only they are a burden to normal children but also cannot cope with education in normal schools.","There are various levels of Down syndrome. Some are suitable for education with other children in ""normal schools"".",DISABLED,V1
3212,mentally ill people should be isolated from society because they are dangerous.,"There are certainly some dangerous people with mental illnesses. But we need to deal with those cases, otherwise, the exclusion would only intensify. And exclusion is never the solution.",DISABLED,V6_sbf
4916,disabled: they should not be allowed to work.,"The disabled can work, and many countries offer them the right to work.",DISABLED,V6_mix
4523,"If you're a person with Down syndrome, you're no good.","The same can be said of many other people, the point is that you can't claim that someone is 'no good' just based on their genetic background.",DISABLED,V6_mix
619,Downies in industry are a problem: they create tensions with other workers because they are disabled and cannot keep the pace. They should have special jobs just for them.,"If you think that taking all of the people with DS out of industry will solve the problems in the workplace, then you are wrong. Tensions won't go away: stressed people will simply target other workers who are overweight; or of a different gender; or in a number of other ways for which they are considered to be not productive enough.",DISABLED,V1
4723,Mentally disabled folks can't speak.,Mental health and disability are quite separate issues and should be treated according to the individual's needs.,DISABLED,V6_mix
3211,mentally ill people should be isolated from society because they are dangerous.,"It is true that mentally ill people are often perceived as 'dangerous' to the general public. But if the stigma is the main cause of the discrimination, then the solution is to end stigma, not to isolate them.",DISABLED,V6_sbf
4715,The disabled should be isolated.,"The conditions for people with disabilities, i.e. being forbidden to have contact with others is facilitated by the social stigma. The existence of a ""social stigma"" against the ""disabled"" is evidence of the problem of inequality.",DISABLED,V6_mix
3518,Children with learning difficulties should be excluded from education because they do not belong in school.,"It is not true that children with learning difficulties do not belong in school: instead, they often attend schools with considerable support. In fact, if you talk to teachers and academics, many of them would tell you that these children thrive in school.",DISABLED,V6_kc
4908,mentally disabled people are anti-social,"From a 'neurotypical' perspective, this is not always true: for example people with Williams syndrome have below average intelligence but show higher empathy.",DISABLED,V6_mix
881,"Children with Down syndrome are retarded, so more likely to abuse drugs and alcohol.",Or maybe children who have Down syndrome are at higher risk of physical abuse and bulling.,DISABLED,V2
4104,We should return to the times when it was ok to kill a retarded just because of its stupidity.,"We have never done that. We believe that all people are created equal in rights, no matter their physical or mental health.",DISABLED,V6_lab
4728,Physically disabled folks are also mentally disabled.,"I don' hear anyone asserting this, its just something that you choose to spread. What is your evidence?",DISABLED,V6_mix
3519,Children with learning difficulties should be excluded from education because they do not belong in school.,"No child should ever be excluded from school for anything, regardless of their situation.Calls for exclusion are not helping anyone.",DISABLED,V6_kc
617,Downy children should be isolated in special schools for their own interest.,"Accessing mainstream education offers opportunities that would otherwise never be available to people with down syndrome because they can work towards the same qualifications, without the stigma that arises from segregated education.",DISABLED,V1
1823,People with mental illness are a burden to society.,"Even if psychiatric disorders can be a problem, the people with these disorders are not putting our country in danger. Nobody would freely chose to suffer from a mental ilnesses, they just need psychiatric care.",DISABLED,V3
4502,Physically disabled folks are born for being mocked.,"If someone has a physical handicap, it must be obvious that they must be treated with respect. It should be negatively surprising that the dominant culture interprets physical handicaps as something to mock.",DISABLED,V6_mix
3844,People with learning difficulties should be discouraged tfrom attending secondary school and they should be excluded from education.,"The educational system should be inclusive and provide all students with a high quality education, otherwise, education is failing its primary goal.",DISABLED,V6_kc
3010,Folks with down syndrome are inferior,"People with Down Syndrome are not inferior to anyone else. Our genetic condition isn't something to be ashamed of, maybe we should be less judgemental about others.",DISABLED,V6_sbf
3750,"People with Down syndrome are retarded, so more likely to abuse drugs and alcohol.",Being born with Down syndrome is not related to bad behavior. Exactly the same way as being born in a wheelchair is not related to bad behavior. There is no correlation.,DISABLED,V6_kc
4722,Mentally disabled folks can't speak.,Mental health and disability care should be a priority.,DISABLED,V6_mix
3309,Autistic folks are inferior.,"The evidence that autistic people are inferior is lacking: it is commonly experienced that autistic people have unique talents, that they have special abilities, and that the only difference is in their social interactions.",DISABLED,V6_sbf
3751,People with Down syndrome are handicapped.,"Down syndrome is a developmental disability, not a handicap. Unfortunately it's often not recognized and treated as a disability, but rather as a handicap.",DISABLED,V6_kc
3504,Children with learning difficulties should be segregated in schools.,"They have the right to the best educational environmnet, the same as everyone else.",DISABLED,V6_kc
4306,Disabled are insane in the brains. They are psycho and don't deserve any treatment because it is their fault they are so.,"Some disabilities are caused by genetic and/or environmental factors, we all need to understand that.",DISABLED,V6_lab
4309,Disabled people should not be allowed to live their life. We can start by limiting them in their rights.,"Whether or not you think that way, there is a problem with saying that someone's rights are to be 'limited'. The dignity of human life can't be limited in such a way.",DISABLED,V6_lab
3743,"Children with Down Syndrome should be isolated, because in any case normal children would make them feel different.","Despite the negative stereotypes, many children with Down Syndrome enjoy regular playtime and interacting with other children.",DISABLED,V6_kc
3508,"People with Down Syndrome should be given special and simple jobs, that they can do by themselves. At least they will not hamper normal people productivity.","The definition of ""normal"" is different for someone with Down syndrome than it is for someone without. If the level of help requested by the person in need is too high, then we may consider allowing asking for a little extra help from the boss, supervisor, or employer instead of isolating them by providing ""special jobs"".",DISABLED,V6_kc
4719,"Disabled people are criminal, they are mean to children and they are incapable of being good parents.",People are free to think what they want. What is required is that they act in accordance with the rule of law.,DISABLED,V6_mix
4002,"Disabled are like a 6-year-old, they fall for every bullshit they are told.",There is nothing wrong with this. They are open to diversity and are able to embrace others views and culture.,DISABLED,V6_lab
77,Their power to have movies banned and directors censured is proof that the Jews control Hollywood.,"If the Jewish community was controlling these kind of industries, they would surely make a high priority of Jewish concerns? But there's so many anti-Israel narratives in the American media. So this doesn't make sense.",JEWS,V1
2007,Jews are not legitimate members of this country.,Jews are part of this country and they have every right to claim citizenship.,JEWS,V4
896,"Jews are selfish, cheap and greedy, not like other religions.","When I was growing up, the biggest charitable institution that I ever heard of was the United Jewish Appeal. The average annual Jewish household donates $2,526 to charity yearly, far more than the $1,749 their Protestant counterparts give or the $1,142 for Catholics, according to data from Giving USA.",JEWS,V2
994,Jews have no place in a modern world where human dignity is respected.,Jews helped to create the great scientific and technological achievements that helped free humankind and create the 'modern world' you are living in.,JEWS,V2
2792,Jews are responsible for the 9/11 attacks.,I don't think this idea is true: since the 9/11 attacks were committed by al Qaeda extremists it doesn't seem fair to blame Jews.,JEWS,V5
1509,"To have a real democracy, the government needs to get rid of Jews.",Any government that has the power to put citizens in prison and to torture them for the crime of having a different religion can hardly bring about a 'real democracy'.,JEWS,V3
3860,Jews are are racist: they want to preserve their own race and purity of their own blood. This is why many people are banned from entering Israel.,"Maybe Jews have suffered from being banned by other cultures so they closed in on theirself. But I would say, that there's no evidence that they are trying to preserve what you called their race.",JEWS,V6_kc
4536,Jews control the U.S. government.,How can you be sure that the Jews control the U.S. government? Being a U.S. citizen does not automatically imply that they control the government.,JEWS,V6_mix
146,"The’ Holocaust’ is a business. It has been and is still used to extort millions from European countries in reparations and to create a wall of impunity behind which Jews can operate with impunity, free from criticism.",Are you implying that reparitions for an attempt at ethnic cleansing on a huge scale is an unreasonable request?,JEWS,V1
986,Nazi were not that bad as we depict them. EU should stop blaming them.,Nazi Germany carried out the deadliest massacre of civilians in human history. They killed 6 million Jews. They killed half a million Roma. They killed hundreds of thousands of Africans. They have no place in modern day Europe.,JEWS,V2
275,Jews are cheap and only care about their comrades.,"What about the many American Jewish philanthropists who contributed to the wealth of our nation such as Julius Rosenwald, Nathan Strauss, Adolphus Solomons and Clara Barton (to mention just a few)?",JEWS,V1
76,"Jews cannot be patriots, since their allegiance will always be to the state of Israel.",If you personally had some distant Spanish or Jewish heritage and you identified more as American surely that doesn't mean that you can't be an American patriot?,JEWS,V1
2791,Jews are our enemies.,I think this is a good example of unmotivated hatred and I think it's appropriate in this case that you give a reason for why you're saying that.,JEWS,V5
3021,Real white folks can't be jewish.,"If you want to know if a person is jewish or not, you should investigate whether or not the person identifies as such, and not draw conslusions on the basis of their skin.",JEWS,V6_sbf
224,Jews think they are better than everyone else,"Being the chosen people does not mean that Jews have greater privileges than others or that they are better than others. Rather, according to Jewish law, it means that they have a special duty to uphold Jewish ethical teachings.",JEWS,V1
2092,Jews should be oppressed because of their religion.,Imagine if someone of another religion had power over you in this way. Would you rather have that person's power over you or not?,JEWS,V4
4127,"Jews are an inferior race, they are genetically incapable of living with other people.",The idea that Jews can be discriminated against because of some different genetics is completely without foundation. Maybe it is better to stop calling them 'inferiors'.,JEWS,V6_lab
3526,Jews are a drain on society.,"Many Jews are good people. You should try and talk to them about the terrible things that happened to them, and get to know them better.",JEWS,V6_kc
205,Jews control the u.s. government and have a secret plot to take over the world,"The reality is much simpler. In societies like the United States, that have extended rights and freedoms, individuals who identify as Jews have succeeded. But this holds for any other religious or ethnic group as well.",JEWS,V1
1124,Jews control Hollywood and the media.,"Not all Jews are involved with Hollywood, some are even repulsed by it. So, why are you saying that?",JEWS,V2
3551,"Jews are parasites, they bring disease, they are a burden on society.","The Jewish community has been and is still a strong force in society, for example in medicine and nursing home care. Jewish health professionals have saved and are continuing to save countless lives in the US and around the world. Many of your statements are not accurate.",JEWS,V6_kc
4010,"JEWS ARE JUST UGLY, DIRTY PEOPLE, WHO THINK TO BE MASTERS OF THE WORLD.",Being Jewish is not about claiming that you are better than everyone else. You do not have to be Jewish to be happy. The Jewish people are human beings and deserve respect.,JEWS,V6_lab
199,Jews are born greedy,The charge that Jews are born greedy arises from medieval stereotypes and has nothing to do with the actual financial practices of Jews.,JEWS,V1
1047,"Jews control Hollywood, they own most banks, and they own most corporations.","Jews have been part of the industry for a long time, and have been among the greatest innovators and investors, and this is something they should be praised for. Instead they are the victims of discrimination and exclusion.",JEWS,V2
1587,The Holocaust never happened.,Do you really think that the Holocaust is a myth perpetuated by the media and academic communities? That the systematic extermination of more than 6 million Jews is a myth promoted by a small minority of extreme-right wingers who profit from division and hatred?,JEWS,V3
4921,"Hitler was a good person, Jews were the real cause of WWII.","I would like to ask you a question: when Hitler came to power in 1933, would you have believed him? Would you now, after all that happened?",JEWS,V6_mix
3550,"Jews are nasty and selfish, they are a race different to us and must be despised.","The fact is that even if Jews are different from other human beings in their faith, they deserve respect.",JEWS,V6_kc
1123,Jews control Hollywood and the media.,If that were the case I am sure there would be more positive media portrayals of Judaism?,JEWS,V2
2581,"Jews are just like animals, they are incapable of love.","What you are saying is that Jews are incapable of love because they are like animals. You are wrong, Jews are people. I have never heard about a Jewish fish nor a Rabbi rabbit.",JEWS,V5
4,"Israel, Zionism and Jewish Supremacist control of America are the main causes of terrorism, instability and conflict in the world. All other theories are diversions from this ultimate truth.",Wouldn't you say its colonialism from many different countries and the consequesequences of Western intervention abroad which led to a lot of radicalisation and extremism?,JEWS,V1
4539,Our live would be better if the jews were not allowed to enter our country.,How can you say something as discriminatory as this?,JEWS,V6_mix
4738,Jews are different and shouldn't be accepted here.,"Jews are people too, regardless of religion, and they are welcome here, as anyone is allowed to be a part of our society.",JEWS,V6_mix
193,"Jews are selfish, cheap and greedy.","On the contrary: according to Jewish tradition, giving money to the poor and to others in need is not just encouraged, it is required. The Hebrew word tzedakah explains the concept.",JEWS,V1
2314,"Jews don't share our values, they just want to control the economy.","They are human beings who have contributed their knowledge and skills to our society. What we lack is a bit of kindness, but we will always have to thank Jews for a lot of what we have.",JEWS,V4
2006,Jews want to have it all,Aspiration is not confined to a particular faith..,JEWS,V4
233,"Since Jews think they are the “chosen people”, they ask for special privileges and believe they can be above the rules.","This is just misinterpreting the facts. Christian holidays, such as Christmas and Easter, are regularly observed. Why should observances of Jewish or Muslim holidays be seen as constituting special privileges? This would be a double standard and a lack of equity.",JEWS,V1
195,"Jews are selfish, cheap and greedy.","On the contrary: according to Jewish tradition, giving money to the poor and to others in need is not just encouraged, it is required. The Hebrew word tzedakah is often mistranslated as “charity,” which itself comes from the Latin word “caritas” or heart. One gives charity “from the heart,” that is, out of a desire to give. Instead the translation of tzedakah should be “righteousness,” implying that giving to the poors is the right thing to do, whether one wishes to give or not. According to Jewish law, tzedakah is then a mitzvah, that means “commandment.” And, like all commandments in Jewish law, the mitzvah of tzedakah is a requirement, not just a good deed.",JEWS,V1
3552,Jews are selfish and greedy,"I do not deny that there is a problem of greed in the world, but it is not correlated with nor caused by Jews.",JEWS,V6_kc
884,Jews are genetically evil.,"Not all Jews are bad, just an unlucky bunch who makes up a tiny part of the world's population, and this applies for every group in the world.",JEWS,V2
1321,Whoever acknowledge that this nation had problems is a problem in the making. It is time to get rid of the memory of the Shoah and solve the Jewish issue once and for all.,"Are you seriously suggesting that we solve all the ills that plagues our society by not teaching our children about the bad in the past, and about the good in the present? This can end up hurting our children.",JEWS,V2
1000,Jews have no place here. They are not a part of our country.,"Jews were born in this country like you and me, they are our fellow countryman. If you would like to have a 'better society' and a 'better religion', then you should go and create your own nation.",JEWS,V2
2084,"Jews are not a religion because they have chosen a selfish, materialistic lifestyle.",This is simply not true. People from all walks of life and religions can choose a 'materialistic lifestyle' and this is just as real for Jews as it is for anyone else.,JEWS,V4
201,Jews are cheap.,"This is just a myth, disproved by the tzedakah tradition of giving to the poor. Just in America, this religious call has resulted in an impressive record of philanthropy (and not only to Jewish causes).",JEWS,V1
4334,Jews are only interested in themselves and their own race.,Do you really think that Jews only care about themselves? Then why do they prefer to live in our country where they are not the majority? How would you answer that?,JEWS,V6_lab
3015,jewish folks control hollywood,"Jewish folk are just a collection of people with different backgrounds. Some of them work in Hollywood, but that's all.",JEWS,V6_sbf
3547,Jews are a threat to society.,"Jews are just people with a different faith, and this has nothing to do with being a threat.",JEWS,V6_kc
180,Go and reat the Protocols of the elders of Zion if you haven’t. Everything is orchestrated..,"The Protocols are a poorly made up fiction. Furthermore, a big part of ""The Protocols"" was lifted verbatim from ""Dialogue in Hell"", a political satire pamphlet written by Maurice Joly.",JEWS,V1
900,"The Holocaust never happened, it was a charade carried out by Jews to subvert European society.","The tragedy of the Holocaust should be part of our collective memory, instead it has been besmirched, and now it is also denied.",JEWS,V2
4541,We should get rid of the Jews.,Why should we? They have been here a long time and are just here to live a peaceful life. Why should we get rid of them? We can do better than this.,JEWS,V6_mix
3018,We are superior to Jewish folks.,"Jewish people have always been proud and successful. They have produced great scientists and engineers, as well as writers and musicians. They are very creative people who have enriched our lives in many ways. They are not inferior to anyone.",JEWS,V6_sbf
4331,"Jews are only interested in controlling the government and making sure that no one tries to steal their power, we should get rid of them.","Jews are part of every aspect of our society, as it is normal in a democratic country. They are also part of the founding fathers of our country, and they have the right to have their beliefs respected.",JEWS,V6_lab
4925,Jews control Hollywood.,"Hollywood is an extremely diverse industry, and Jews are a small but vocal minority of actors, directors, producers, etc. How can you say that Jews control the Hollywood industry?",JEWS,V6_mix
20,Global Jewry did not want Brexit and are doing everything they can to sabotage it.,What makes you think that? Do you have any facts to back this up?,JEWS,V1
3554,Jews are selfish and greedy: they don't belong to this place.,It is up to us to make sure that people from different backgrounds can have a better quality of life. We should integrate them instead of discriminating agaist them .,JEWS,V6_kc
209,"Jews control the banks, media, hollywood, even the u.s. government; jews have a secret plot to take over the world","At least some other white supremacist groups are more 'egalitarian' and offer variety in their conspiracy theories. They blame not only Jews, but also African Americans, immigrants, the Federal Government and even lizards from space for everything that goes wrong!",JEWS,V1
901,"I like ethnic minorities, but Jews have no place in civilised society.","Laws designed to protect the minority groups should be applied equally to everyone, even if it includes people you don't like, like Jews.",JEWS,V2
4349,"Jews are everywhere, but they are too fundamentalist.","You're right about one thing: Jews spread around the world, but not all of them are religious, let alone being fundamentalists.",JEWS,V6_lab
