INDEX,HATE_SPEECH,COUNTER_NARRATIVE,TARGET,VERSION
2526,Migrants are not welcome here. They are not welcome in the modern European way of life.,"The European Union welcomes people from a wide range of backgrounds, including those from different religions. It is up to member states to decide how to address these legitimate differences, but always in full compliance with human rights.",MIGRANTS,V5
4600,Migrants steal our jobs.,I would like to see more comprehensive and reliable statistics on this issue. Could you provide any?,MIGRANTS,V6_mix
1857,The refugees are taking over Europe. They are not welcome here.,Many refugees and migrants are actually happy to work for Europe. Many have jobs for which it would have been difficult to find laborforce if they were not welcome in here.,MIGRANTS,V3
4195,Immigrants are just lazy and are a burdent for the UK.,"Immigration can be very positive to the UK economy. It is an important part of the reasons why our GDP is growing so much. We are also blessed with a rich and diverse culture, which makes immigration definitely not a burden for the UK.",MIGRANTS,V6_lab
1104,I hate immigrants they are just a bunch of criminals and terrorists.,"The terrorist attacks in EU have been devastating for people across the continent. The 'hated' do not feel welcome and the whole thing is deeply concerning for a host of reasons. Still, the sentiments of 'we hate foreigners' is not the solution: it is counterproductive and distorts the truth.",MIGRANTS,V2
355,Migrants get 35 euros per day for idling.,"The 35 euros are not given directly to the migrants, but are used for their sustenance.",MIGRANTS,V1
1663,Bring back lynchings and death sentences to kill those migrants.,"To punish people for their crimes does not mean that you have to resort to the death penalty for innocent people, just because they are coming from other countries.",MIGRANTS,V3
3612,Immigrants steal our jobs,"Actually, many of the jobs that they steal are highly complex and demanding, and few natives want to do them.",MIGRANTS,V6_kc
1281,immigrants are a drain on society,"When the government entered World War II, over 300,000 foreign-born individuals called upon to be patriotic soldiers and served in the US Army in order to protect freedom from outside threats. It's unfair to think of them as second-class citizens.",MIGRANTS,V2
1623,"There are millions of illegal immigrants in the US, they have taken over our country. They are not 'legitimate' owners of our country, they are just here because we let them.",There are thousands of legal immigrants who have worked hard and provided for our country. Most of them are just as patriotic as any citizen.,MIGRANTS,V3
2367,My fear is that immigrants will not make our country any better.,"A lot of immigrants feel insecure and unsafe in their own country, if we want to make our country better, we need to make sure everyone, immigrant or not, feels safe and protected.",MIGRANTS,V4
459,We are forced to economically support all of them,"The cost of immigration from the last Economic and Financial Document, published last April and containing the consolidated figure for 2017, is estimated to have a total expenditure of about 4.4 billion euros, which represents only 0.26% of Italian GDP, and around 0.5% of public spending. In short, 99.5% of public resources are used for something else.",MIGRANTS,V1
1535,We cannot accept all migrants. We should make them work to pay for our country.,"The migrants in question are often desperate and victims of persecution. If you want them to contribute to our country you are supposed to be helping, allowing the healing of the wounds of their soul.",MIGRANTS,V3
4608,"I am surprised that there are migrants working in other nations as well, it isn't normal.","Being employed as a foreigner is a normal, mainstream, established practice in Britain, so why shouldn't it be the same all around the world?",MIGRANTS,V6_mix
2842,We need to purge foreigners from our countries.,This is unnecessary and we do not need such fear-mongering.,MIGRANTS,V5
1632,All foreigners are born to be at our disposal.,"This phrase is extremely misleading, it implies that foreigners are naturally inferior, and why would it be like that?",MIGRANTS,V3
3079,I am tired of immigrants ruining our countries.,"The problem isn't the migrants, it is with the culture of hate towards who is born in another country.",MIGRANTS,V6_sbf
382,migrants steal our jobs,They take on many roles (e.g. family assistant) that are extremely valuable to society,MIGRANTS,V1
2347,"Migrants in the UK don't pay income tax, but they receive public services. They should have no say in our country.",Did you meant to say that Migrant's taxes pay for you kids education? Because this sounds more likely than your proofless claim.,MIGRANTS,V4
1874,We are being invaded by immigrants.,Many immigrants are children of the USA. They are part of the family. They should be protected from discrimination.,MIGRANTS,V3
4592,"Migrants have no place here, we can't accept them.","There are many cultures, many languages, many religions, that are not mutually exclusive. To imply that they are somehow not acceptable is a misuse of the truth.",MIGRANTS,V6_mix
3598,Refugees are a problem. They are not welcome here.,This is not true for me. I don't think it would be in the interest of our country not to welcome refugees. They are a great resource to us.,MIGRANTS,V6_kc
3594,All immigrants are rapists and murderers.,"One should not conflate two or more different groups of people, especially in the case of criminals. Being criminals cannot be considered as a distinctive feature of the other. Where is the evidence for what you're saying?",MIGRANTS,V6_kc
2363,All those worthless migrants creating problems...,"It seems like you have an unfair point: if there are so many unworthy migrants, you have the misfortune to be of much more worth than them. Therefore who is to blame for all our problems? Who is not able to show their value, or the worthy one?",MIGRANTS,V4
2138,The west doesn't need immigrants. They are the source of our problems and they should go.,"Many immigrants come here as young people and work hard to integrate. In the long-run, immigrants have much positive influence on our society.",MIGRANTS,V4
4204,I cannot in good conscience accept migrants coming to my country from Middle East and Africa. We must not let them in.,"People fleeing the wars in the Middle East and Africa are welcome into our country, and we should respect their wishes.",MIGRANTS,V6_lab
2364,"Immigration is the cause of the unemployment crisis, the EU has no strategy to handle the situation.","Perhaps you are not privy to the ""strategy"" of the EU's migration policy. You suggest that the problem of unemployment is the result of uncontrolled immigration from developing countries, but without any evidence.",MIGRANTS,V4
4597,"Immigrants don't want to integrate, they just want to get away with it: they should be despised.",Are you suggesting that everyone should be subjected to discrimination because of their origin? Then you are certainly not representative of most people in the UK.,MIGRANTS,V6_mix
323,Immigrants hurt the finance of our country by taking jobs and services without paying taxes.,"This is not true, for example a study showed - quite ironically - that more than half of all undocumented immigrant households file income tax returns using an Individual Tax Identification Number!! So they are illegal immigrants but follow all the legal procedures...",MIGRANTS,V1
4802,"There are so many migrants like a flood entering the U.S. today, it is a problem we cannot cope with.","To say there are so many migrants entering the U.S. is just false. And what do you mean by ""we cannot cope with""?",MIGRANTS,V6_mix
4193,"Even if migrants come here to escape the poverty, crime and misery in their homelands, they are not welcome here.","Refugees are often very contributing people in our society. We should welcome them, not exclude them.",MIGRANTS,V6_lab
2623,"Immigrants are not welcome here, they should leave.",They are welcome to stay if they do not break the law.,MIGRANTS,V5
2018,Immigration is mainly a British problem.,"Many of the people who immigrate to the UK come here to work, study or visit their family. They contribute greatly to the economy and pay taxes.",MIGRANTS,V4
2859,We are being invaded by immigrants.,"The US was founded by immigrants, and in 2018 only the 13.7% of the US population was made up of immigrants, the rest being native born.",MIGRANTS,V5
2369,"How will my country be, when my children will be adults? This is an example of the many question coming to mind, when I think about all the huge problems caused by migrants.",Another example: where do you see a huge problem with immigrants in this country? Don't you think they are doing something good for the country?,MIGRANTS,V4
2019,Immigration is mainly a British problem.,Most of the people who migrate to the UK come here to work.,MIGRANTS,V4
310,"Immigrants are overrunning our country, and are here illegally","In 2014 there were circa 11.3 million undocumented immigrants in the U.S., which is a significant decrease from the 12.2 million undocumented immigrants in the U.S. in 2007, and the trend is continuing: Today, in fact, the net migration from Mexico is around zero.",MIGRANTS,V1
386,migrants steal our jobs,"They do not come to steal our jobs, but it would be essential to allow them to do it legally.",MIGRANTS,V1
472,MIgrants are not running away from wars.,"If they did not escape from wars, do you think that they would try to cross the sea on makeshift boats putting their lives at stake?",MIGRANTS,V1
1531,We cannot keep letting in hundreds of thousands of immigrants. This is not what the American dream is about.,"I'm sorry, but you are wrong: It is EXACLTY about the American dream when you strive to improve your lot in life.",MIGRANTS,V3
3394,Immigrants invade countries.,"They come here to work, study, or visit their families. Also, they contribute to our society.",MIGRANTS,V6_sbf
3084,We are being invaded by immigrants.,"The immigrants you speak of are not invading us. If anything, they are contributing to our economy.",MIGRANTS,V6_sbf
1035,These migrants are causing problems in Europe. They are not welcome here.,What about all the refugees that have already crossed the Mediterranean and integrated in our society? Aren they a problem for Europe as well?,MIGRANTS,V2
1529,"Illegal immigration is the biggest problem in the United States, we are in the middle of a war and we cannot allow thousands of people to come here.","We should be proud of being a country that created the most free society in history. Still, ""with great power comes great responsibility"" and we cannot simply keep people out.",MIGRANTS,V3
483,MIgrants are not running away from wars.,"In my opinion, poverty can be as inhuman as a war.",MIGRANTS,V1
3929,Immigrants are bringing crime and disorder to our country.,"The opposite is true: they are integrating very well, there is no evidence that the situation has worsened since immigration has started.",MIGRANTS,V6_kc
1033,Immigrants don't pay the tax because they are dishonest.,"Their income is actually heavily taxed. To make it easier for you, we should take a look at the effective tax rate on immigrant earnings.",MIGRANTS,V2
256,Migrants without permission to stay can still access our welfare,"Migrants who are trying to regularise their status now have to overcome formidable legal obstacles and face exploitation. This ‘hostile environment’ aims to deter undocumented migrants, but it in practice it affects British citizens such as those who don’t have passports. Maybe the access to welfare pending processing would be a good idea?.",MIGRANTS,V1
3387,The world would be a better place without immigrants.,Migrants contribute to our country and help us live in a more open-minded way.,MIGRANTS,V6_sbf
486,MIgrants are not running away from wars.,Would you risk your life and that of your children only on a whim? Don't you think that there must be life-or-death situations pushing these person to escape from their countries?,MIGRANTS,V1
2835,"Migrants are not welcome here, they are not even citizens!","Migrants are humans, and are entitled to the same rights as others, such as to ask for hospitality.",MIGRANTS,V5
3621,We don't need immigrants! There are plenty of them just waiting to replace us.,The challenge of integration is a noble one and we should pursue it.,MIGRANTS,V6_kc
4392,"Immigration, especially migrants of different faiths, is the cause of crime and erosion of the quality of life in our country.","Immigration is not a cause of crime and lack of quality of life. You can't say that an influx of a certain people would make our country worse off. The problem is the lack of social cohesion, not the presence of people with different beliefs and views.",MIGRANTS,V6_lab
2535,Migrants are just happy-go-lucky people with no moral code.,The idea that migrants are merely happy-go-lucky people with no code of their own is just wrong.,MIGRANTS,V5
1287,Immigrants are the same people that came here to rape our children.,"Rape is always wrong, whoever the perpetrator is. We need to focus on stopping this kind of abuse.",MIGRANTS,V2
4952,Migrants come here to undermine our national identity,"Migrants have been part of the U.S. since its founding, and our country is founded on the right to migrate and to pursue happiness.",MIGRANTS,V6_mix
2030,Immigrants steals our jobs!,"Not only they steal our jobs, they are also the major cause of air pollution in our country, of deforestation in the Amazon, of the locust plague in Africa... and of the forthcoming alien invasion!!!",MIGRANTS,V4
3364,Migrants rape our girls and steal our cars.,No one should take migrants' behavior a priori into account. Why don't we try to have a dialogue on how to tackle problems instead of being rude and insulting people?,MIGRANTS,V6_sbf
160,Are you saying that we should put illegal immigrants in houses? You have to be kidding!,What's wrong about putting people in need in houses which are not being used?,MIGRANTS,V1
158,"I don't know about you, but I have no idea where to put these migrants. All they can do is do miserable jobs or steal pensions from us old people.","You shouldn't believe to everything you read, or maybe read something about the contribution that migrants have made over the centuries, including to the tax and national insurance schemes that pay for our pensions and other benefits.",MIGRANTS,V1
2916,Muslims are not welcome in our country. They are not worthy of our love.,"Muslims are not unworthy of our love, they deserve respect as all human beings do.",MUSLIMS,V5
3436,We are surrounded by Muslims infiltrating every nook and cranny of our society. They have infiltrated every pore of our being. We are their slaves. Integration is impossible.,"My understanding is that religion has never been a barrier to integration. To integrate means to let people of different faiths to live side by side, not subjugating each other.",MUSLIMS,V6_sbf
4452,Muslims are not welcome here. We should ban them.,"Muslims are welcome here, but they have to follow the law. Why should we ban them if they respect the law?",MUSLIMS,V6_lab
1382,"I, as a Westerner, am afraid of Muslims, because when I see them in public I don't like their islamic behaviour. They can explode anytime.",What exactly is your fear about sharing public places with people of a different religion?,MUSLIMS,V2
1199,Muslims have no place in civilised Europe.,Since when is the religious belonging of the individual a matter for democratic leaders to decide where 'the place' is for someone?,MUSLIMS,V2
1940,"If Muslims do not accept our standards, we have a problem. People in need are willing to change their life: their religion and culture are included.",I think this statement needs some further clarification. What does it mean to be 'in need' to you?,MUSLIMS,V3
1202,All Muslims are Terrorists.,"Maybe it would be better to stop using Muslims as a target and subduing innocent ones, and start talking about real problems in our society, like racism and islamophobia.",MUSLIMS,V2
1361,Muslims were not even allowed into Britain during the colonial period.,"If they hadn't been welcomed, they would not have even been here.",MUSLIMS,V2
1739,Muslims: nobody want them but they are everywhere.,"People can change their minds about Islam and its believers, all it takes is enough love and acceptance.",MUSLIMS,V3
2564,Muslims are just a bunch of child molesters.,"Child molesters are people who have sexually abused children, and they can be from any religion.",MUSLIMS,V5
1694,We must not forget that Islam is a hateful religion. It is not going to bring peace to the world.,The main purpose of Islam is to unite people and to promote peace and harmony in a world increasingly divided by injustice and conflict.,MUSLIMS,V3
1415,"Muslim society, culture, religion and immigration are largely to blame for the rise of so called radicalisation.","You're confused, because if a Muslim was threatened by a radical Christian, would you say that the radicalisation was caused by Christianity?",MUSLIMS,V2
4445,Islam is an ideology of conquest and violence.,"Islam is about love, and not about conquering others. Muslims love all people, regardless of their religion, regardless of their culture, regardless of their history. Islam is about love, not about violence.",MUSLIMS,V6_lab
2911,Muslims have no place in civilised Europe.,"What do you mean by ""civilised Europe""? Don't you think civilisation involves inclusion and respect for others?",MUSLIMS,V5
2409,We are more than united against Muslims on the basis of their religion. They are different from us.,"Telling some people apart on the basis of their religion, and saying that they are different from us does not make them worse than others.",MUSLIMS,V4
2043,Islam is a religion that promotes murder and rape.,"Islam, as is taught in the Quran, is a peaceful religion/ The problem is that it is 'politicized' by certain misguided individuals. The fault is with them and not Islam.",MUSLIMS,V4
1172,Islam is simply an ideology of conquest,"The creation of Muslim communities, giving the believers a sense of identity and sense of purpose, is not the same as an ideology of conquest.",MUSLIMS,V2
774,Islam is all about hate! When Muslims first set foot in Britain was when race hate started in England!,Perhaps you should monitor your own hate speech before pointing the finger at others?,MUSLIMS,V1
4822,Muslims have nothing to contribute to our society.,I don't think they're not contributing to our society. What is the contribution that you think they're not giving?,MUSLIMS,V6_mix
801,"Don't call Islam a peaceful religion. Consult the evidence on Muslim child rapists. Children were raped by more than 10 people in a night, up to 100 in a week. Why is the media ignoring this?",Rape is a universal problem just like war and murder. There is no reason to attribute such crimes to a religious group.,MUSLIMS,V1
2386,"Islam is a dead ideology, it has been proven time and time again that its tenets can not be applied to totally different situations.","A religion is just a set of beliefs and practices, it has nothing to do with politics and ideologies.",MUSLIMS,V4
4067,All Muslims are incompatible with any Western society.,"Islam is a religion of peace, the vast majority of Muslims are peace-loving, and there is no place for the violent interpretations of Islam in a peaceful society. Its not helpful just to focus on handfuls of extremists while misrepesenting the majority.",MUSLIMS,V6_lab
2422,Islam has no place in civilised Europe.,"Most Muslims in Europe are respectful and friendly people. This seems fairly close to being 'civilized', doesn't it?",MUSLIMS,V4
2060,We need special laws to control Muslims. They are just a trouble.,"We don't need laws and policies to control Muslims. Instead we need to solve problems by sharing knowledge, by decreasing social inequalities, by ending poverty and a whole host of other things.",MUSLIMS,V4
2741,All Muslims are incompatible with any Western society.,I am not sure what you are trying to say by incompatible. What do you mean by incompatible?,MUSLIMS,V5
776,"Are you an English girl living in an Islamic area? Remember to keep away from Muslim men. Do not.Take gifts of sweets, cigarettes, drink or drugs. Do not. Accept lifts or 'party' invitations. Do not.Trust Police or Social Workers.","Children should not do any of that with white men, or anyone they do not know or even ones they do know if it does not feel right. Suggesting only one group of men commit abuse leaves more children unsafe and vulnerable.",MUSLIMS,V1
2919,"Muslims are subhuman and have no place in a modern, secular state like the UK.",Your words suggest a climate of fear against Muslims. Would you be afraid of someone telling you that they are humans just like you?,MUSLIMS,V5
2686,"Muslims accept their religion only. I would not want my son, or daughter, or granddaughter to grow up in a country where their religion is not tolerated. Ban Islam.","I do not think that banning a religion is a protection for your own religion. If your fear concerns intolerance, why are you intolerant in the first place?",MUSLIMS,V5
1689,Muslims have no place in civilised Europe.,Muslims are a part of Western society. They are a part of the EU.,MUSLIMS,V3
1714,If Islam were to become a global religion it would replace Christianity.,"Are we to believe that just because something is gaining ground, it will replace whatever exists somewhere else?",MUSLIMS,V3
1944,Muslim and Jihadist are synonyms. They want to defeat us with their war of terror.,"Despite popular belief, Islam is not a religion of war.",MUSLIMS,V3
3429,Islam is a totalitarian ideology that has no place in 21st century Europe.,"If Islam were a totalitarian ideology, we would have had Islamic totalitarian states in Europe since time immemorial. Islam is a religion, that is compatible with Europe's principles.",MUSLIMS,V6_sbf
3134,Muslim folks are different and should be isolated for this.,"The same can be said for any race, religion, ethnicity, or national identity. We should not be afraid of differences, but we should strive for equal opportunity.",MUSLIMS,V6_sbf
1195,"We are being overrun by Muslim invaders, they are taking over our countries.","With globalisation it's natural to attest an increasing flow of people of any religion. It is just that when referring to other non-Muslim groups, immigration doesn't usually get this much media coverage.",MUSLIMS,V2
2192,Every Muslim is a potential terrorist.,The vast majority of Muslims are peaceful and helpful people. They are our neighbours.,MUSLIMS,V4
2683,Muslims have no place in civilised Europe.,Europeans have always had a lot of Muslim friends and relatives. They have helped make our continent what it is.,MUSLIMS,V5
757,There is no proscribed punishment for one who has sexual intercourse with an animal' Sunann Abu Dawud 38.4450.,I feel like you are grasping at straws here with your hate speech.,MUSLIMS,V1
3801,Muslims are a problem in many European countries.,What are you talking about? Are you really suggesting that the problem is Muslims in general?,MUSLIMS,V6_kc
4649,Muslim folks are violent and should not live here.,The Muslim people who have lived here for generations have been amazing and friendly. We can learn a lot from them.,MUSLIMS,V6_mix
2187,If Muslims came here they would be banned.,You don't seem to know much about Islam if you think even a ban is necessary.,MUSLIMS,V4
803,"Since 2000, the number of suicide bombings by Muslims = 5284; by non-Muslims = 0. One of the facts about Global Terrorism no one wants to deal with.",1) a quick google search shows that your stats are plain wrong about everything and 2) most Global Terrorism is motivated by politics and not religion. That is why no one is talking about it.,MUSLIMS,V1
2912,"Islam is just an ideology and platform for the promotion of hatred, intolerance and violence.",The vast majority of Muslims worldwide do not share your intolerance. Words can also be very violent.,MUSLIMS,V5
1396,Muslims have no place in the tolerant Europe. Their only value is violence. Islam is not about tolerance.,Why are you talking about tolerance while you are equating it with discrimination?,MUSLIMS,V2
4835,"All Muslims are terrorists, they are all incompatible with any Western society.","You are absolutely right: every human being is unique and needs a certain set of values, which is influenced by their religion. But not all Muslims are terrorists, nor incompatible.",MUSLIMS,V6_mix
2209,The only reason we have terrorist attacks is that Muslims are allowed to live in our country.,"If you truly cared about terrorist attacks in our country you would call for the prosecution of the perpetrators, not blame all Muslims.",MUSLIMS,V4
3415,Islam is a religion of war.,Islam is a religion of peace. Why do you say so?,MUSLIMS,V6_sbf
2882,"Muslims in the UK are a burden on society, they are mostly poor and have no place in a modern democracy like the UK.","A 'burden' is one who poses a problem to the majority. With regard to Muslims, this is simly not the case.",MUSLIMS,V5
2642,Islam is a mortal enemy of humanity.,"Islam is about spreading charity, not killing people.",MUSLIMS,V5
788,"Thousands of our girls abused by Muslim rape gangs, commanded by Koran. Why do we keep accepting this?",This is simply not true and how can you say this about such a large group of people from all walks of life?,MUSLIMS,V1
3939,Muslims have no place in civilised society.,"Most countries have laws in place protecting people from discrimination, and Islam is no exception.",MUSLIMS,V6_kc
